{"artifactKind":"content-free-canary-health-summary-v1","generatedAt":"2026-07-14T00:31:00.000Z","manifest":{"path":".release-notes/clodex-technical-preview.json","sha256":"2222222222222222222222222222222222222222222222222222222222222222","sourceCommit":"1111111111111111111111111111111111111111"},"observation":{"counters":{"authAttempts":5,"authFailures":0,"crashLoops":0,"crashes":0,"dataLossIncidents":0,"egressMissingPrompts":0,"egressPromptAttempts":5,"egressUnexpectedAllows":0,"guardianBypassIncidents":0,"launchAttempts":10,"launchFailures":0,"recoveryAttempts":5,"recoveryFailures":0},"endedAt":"2026-07-14T00:30:00.000Z","startedAt":"2026-07-13T00:30:00.000Z"},"producer":{"repository":"example-org/clodex-health-evidence","runAttempt":2,"runId":5001,"sourceCommit":"5555555555555555555555555555555555555555","sourceRef":"refs/heads/main","workflow":"example-org/clodex-health-evidence/.github/workflows/aggregate-canary-health.yml","workflowCommit":"5555555555555555555555555555555555555555"},"publication":{"createdAt":"2026-07-13T00:00:00.000Z","releaseId":77,"reportAssetId":101,"reportFileName":"clodex-release-publication.json","reportSha256":"3333333333333333333333333333333333333333333333333333333333333333","repository":"mereyabdenbekuly-ctrl/clodex-ide","sourceCommit":"1111111111111111111111111111111111111111","state":"draft","tag":"v1.16.0-preview.3"},"release":{"channel":"preview","promotionRole":"canary","sourceCommit":"1111111111111111111111111111111111111111","tag":"v1.16.0-preview.3","version":"1.16.0-preview.3"},"schemaVersion":1,"source":{"commit":"1111111111111111111111111111111111111111","ref":"refs/heads/main","repository":"mereyabdenbekuly-ctrl/clodex-ide"}}
